code,product_name,ingredients_text
8480000465702,Shampoo,"Utilicese preferentemente antes del final de (mes/ano): ver envase.
POLYSORBATE 20, COCAMIDOPROPYLAMINE OXIDE, TETRASODIUM GLUTAMATE
BUTYLENE GLYCOL, MALIC ACID, TRIDECETH-9, HEXYL CINNAMAL, BENZYL
DIACETATE, COCO-GLUCOSIDE, POLYQUATERNIUM-7, SODIUM HYDROXIDE
DULCIS SEED EXTRACT, CITRIC ACID, PARFUM, STYRENE/ACRYLATES COPOLYMER
SALICYLATE, LINALOOL, SODIUM BENZOATE, BENZOIC ACID, POTASSIUM SORBATE
DULCIS JUICE, CITRUS PARADISI JUICE, PYRUS MALUS JUICE, PRUNUS AMYGDALUS
INGREDIENTS: AQUA, SODIUM LAURETH SULFATE, COCAMIDOPROPYL BETAINE,
A utilizar de prefer�ncia antes do final de (m�s/ano): ver embalagem
Vitaminas y Antioxidantes, que aportan al cabello un aspecto saludable
Champo para toda a familia com Extratos de Frutas Naturais, rico em Vitaminas
Champu para toda la familia con Extractos de Frutas Naturales, rico en
e CHAMPU FAMILIAR
CHAMP� FAMILIAR
a
e Antioxidantes, que fornecem ao cabelo um aspeto saudavel
MODO DE USO
Humedece el cabello con agua, aplica el champu en las manos, frotalasY
masajea el cuero cabelludo y el cabello hasta producir espuma. Aclarar con
abundante agua. PRECAUCIONES: Evite el contacto con los ojos y mucosas. En
caso de contacto con los ojos, aclararlos inmediatamente con abundante aqua.
No ingerir. Mantengase fuera del alcance de los ninos.
PHumedeca o cabelo com aqua, aplique o champ� nas m�os, esfreguease
massaje o couro cabelao e o cabelo ate produzir espuma. Enxaguar com agua
em abund�ncia. PRECANCOES: N�o pode entrar em contacto com os olhos
mucosas. Se entrar em contacto com os olhos, enxaquar imediatamente com
abundante agua. Namgett Manter fora do alcance das criancas.
INGREDIENTS: AQUA SODIUM LAURETH SULFATE, COCAMIDOPROPYL BETAI
ese preferentemente antes del final de (mes/ano): ver eivase
RECICLA"
67238891190,Original beauty bar,"Dove is not a soap. It's a beauty ber
The secret to beautiful skin is everyday moisture and no other bar hydrates skin better the
Dove. With moisturizing cream, this beauty bar cares for your skin leaving it scft and
smooth. It's a simple daily step to reveal beautiful, radiant skin
Dove no es un jabon comun. Es una barra de belleza.
El secreto para una piel bonita es la hidratacion diaria y ningun jabon comun humecta me
que Dove. Con 4 de crema humectante, esta barra de belleza cuida tu piel dejandols suave
tersa. Usalo diariamente y descubre tu piel naturalmente bonita y radiante
Dove
original
INGREDENTES SOOIM LAUROYL ISETHIONATE, STEARIC ACID, SODIUM PALMITATE, LAURIC ACID, AQUA, SODIUM ISETHIONATE, SCOUM STEAR
COCAMIDOPROPYC BETANE, SODIUM PALM KERNELATE, GLYCERIN, PARFUM, SODIUM CHLORIDE, ZINC OXIDE, TETRASCDIUM ECTA, TERASCIO
ETDRONATE ALUAMNA, ALPHA ISOMETHYL IONONE, BENZYL ALCOHOL, BUTYLPHENYL METHYLPROPIONAL, CITRONELLOL, COUMARIN, HEXY OMAA
LMONENE UNLOOLO 77891
MADE IN GERMANYMECHO EN ALEMANIA: MANUFACTURED BYPRODUCIDO POR: UNILEVER DEUTSCHLAND PRODUKTIONS GMBH"
3660005018812,Balsamo frambuesa,"Baume Nourrissant Senteur Framboise Nourishing Lip
Balm-Raspberry Scent &quot; Balsamo Labial Nutritivo Aroma
de Frambuesa Pflegender !LUobalm Himbeer-Duft
| 01881
4.8g-net wt. 0.17oz.
Yves Rocher-56201 La Gacilly
France-Made in France
6600 050 188"
7506078948020,Bi-o,"h Ave B Espino y Catada El Almendra Antiguo Cuscattin, La Liberta
Cac em RIF H00009042-4 MPPS MSO
Ree en Menico por: COSBEL SA de C.V. Hecho para FRABEL S.A DE
HORDOROCINNAMATE - ZINC PCA BENZYL SALICYLATE
CF Cus NS Col. Tacoquemicat del Vale CP 03200 Mexic DF
ti LOrial Argentina SA. Juramento 1775 CABA C1408ONA
BENYL ALCOHOL LIINALOOL CAPRYLYL GLYCOL GERANI
SA A Chera 11101, San Bemardo-Santago Reg ISP O10ST
te Eme-Poo 17 y 18 Cludad de Panam, Panami GuatemalzLOREAL
Res 15598 Uruguay por LDreal Unuguay S.A. Avenit
LOREAL PANAMA S A PH Tome Panama Bhd Costa del Este Uth Cost
EALA SAZ Cale 24-00 Zona 15, Vista Hermosa Edifice Doman
SUCURSAL EL SALVADOR Edificio Centro Corporative Madre Seke 5
1NGREDIENTES AQUA/WATER-ALLMINN CHLOROHYORATE
P-5-UTETH-26 STEARETH-100PIG-136HD COPOLYMER&quot;
M/FRAGRANCE PEG-40 HYDROGENATED CASTOR OL
MONENE
PENTAERYTHRITYL TETRA-D-T-BUTL
CTONELLOL HEXYL CNNAMAL FIL: CO95187
Peni: LOREAL PERUL SA LIMA PERU
Chile LOREAL CHILE
Columbia
9 ore 1701
358
www.gomier.com.mx
4089314
MB"
20187385,Tinte premium color,2018 7385
4056489498872,Cell Intense Cien,"/ZUOTATIKa: Aqua, Glycerin, Ethylhexyl Salicylate, Propanediol Dicaprylate/Caprate, Dibutyl
Adipate, Cetearyl Alcohol, Ethylhexyl Triazone, Coco-Caprylate, Alcohol, Butyl Methoxydibenzoylmethane,
Pentaerythrityl Distearate, Glyceryl Stearate, Bis-Ethylhexyloxyphenol Methoxyphenyl Triazine, Glyceryl Stearate
Citrate, CI 77891, Phenoxyethanol, Sodium Stearoyl Glutamate, Panthenol, Parfum, Tocopheryl Acetate, Caprylyl
Glycol, Butyrospermum Parkii Butter, Hydroxyacetophenone, Sclerotium Gum, Galactoarabinan, Oenothera
Biennis Oil, Helianthus Annuus Seed Cera, Ethylhexylglycerin, Linalool, Geraniol, Citric Acid, Xanthan Gum,
Sodium Hyaluronate, Citronellol, Benzyl Alcohol, Anigozanthos Flavidus Extract, Limonene, Citral, Tocopherol,
Magnolia Biondii Flower Extract.
~170331932~"
8480000441003,Spray recuperador rizos,"Resulta ide
para recuperar los rizos al dia siguiente del lavade
ab
Mas consejos en
Precauciones
Evitar el contacto del liquido con los ojos. En caso
de contacto, lavarlos con agua abundante. En caso
de obstrucion lavar el difusor Con agua caliente
No pulverizar el producto sobre tejidos y
evitar el contacto del cabello humedo sobre
la ropa: puede producir manchas.
Ingredients
AQUA, ALCOHOL DENAT. POLYOUATERNIUM-11,
POLYIMIDE-1, HYDROLYZED SILK, BENZOPHENONE-4,
PANTHENOL, QUATERNIUM-26, PROPYLENE GLYCOL
PEG-40 HYDROGENATED CASTOR OIL, GLYCERIN,
PARFUM, PEG/PPG-25/25 DIMETHICONE,
DIAZOLIDINYL
BUTYLCARBAMATE, LIMONENE. BUTYLPHENYL
METHYLPROPIONAL, CI 15985.
Dermatologicamente testado. Hipoalergenico. pH
neutro. No utilizar para ninos menores de 3 anos.
Utilicese preferentemente antes del final de:
imes/ano).
UREA,
10DOPROPYNYL
200mle
12 M
Telefono de atencion
al cliente Mercadona: LARO
000"
7506306210950,Agua micelar,"POND'SOriginal
Agua Micelar
DESARROLLADA POR EL POND'S INSTITUTE.
LA FORMA MAS PURA DE LIMPIAR LA PIEL', CON AGUA TRIPLSMENTE PURIFICADA
AGUA MICELAR PARA TODO TIPO DE PIEL. SU FORMULA ES RECONOCIDA POR SU
EFICAZ PODER DE LIMPIEZA, ACTUA HACIA ADENTRO LIMPIANDOY REMOVIENDODE
MANERA PROFUNDA&quot; Y SUAVE EL MAQUILLAJE DEL ROSTRO, PARA PODER VERY
SENTIR UNA PIEL LIMPIA Y LIBRE DE MAQUILLAJE POR FUERA, &quot;DE LIMPIADORES DE
POND'S ESTRATO CORNEO. MODO DE USO APLICA POND'S C CROINAL AGUA
HICELAR SQBRE TU ROSTRO, PARPADOS Y LAOS USANDOUN ALGOD�N
MASAJEANDO SUAVEMENTE, NO NECESITAS FROTAR O ENJUAGAR. REPITE HASTA
REMOVER TODO RASTRO DE MAQUILLAJE. ADVERTENCIAS: MANTENER FUERA DEL
ALCANCE DE LOS NINOS. SI OBSERVA ALGUNA IRRITACION, SUSPENDA SU USO. SILA
RITACION PERSISTE CONSULTE A SUMEDICO, EVITE EL CONTACTO CONLOS QUOS
INGREDIENTES: AQUA, HEXYLENE GLYCOL, GLYCERIN, PES CAPRYLICICAPRIC
GLYCERIDES, PHENOXYETHANOL, CETRIMONIUM CHLORIDEETRASODIUM EDTA
PROPYLENE GLYCOL, CITRIC ACID, CETYLPYRIDINIUM CHLORIDE, SODIUM CHLORDE,
POTASSIUM CHLORIDE, SODIUM ASCORBYL PHOSPHATE, NIACINAMIDE, PANTHENOL
ANTHEMIS NOBILIS FLOWEREXTRACT. HECHO EN MEICO POR: ABSARA COSMETICS.
SARL, DE C.V, PARQUE INDUSTRIALY TECNOLOGICO DONA ROSA, AVENDA DELI
NDUSTRIA FARMACEUTICA LOTE 1,2Y3 MZA. 4, COL EMILIANO ZAPATA, CP.520A
LERMA DE VILLADA, ESTADO DE MEXICO. PARA UNILEVER MANUCTURERA,S.DE
RL. DE C.V, TEPALCAPA NO. Z. COE RANOHO SANTO DOMINGO, CP. S490
TULTITLAN, ESTADO DE MEXICO. DISTRIBUIDO POR: UNILEVER DE MEXICO,S. DERL
DE C.V, TEPALCAPA NO. 2.COL RANCHO SANTO DOMINGO, C.P. 54900, TULTITLAN,
ESTADO DE MEXICO. SAC 01-800-99-01900 WWW.PONDS.COM.MX. IMPORTADO Y
DISTRIBUIDO POR: UNILEVER ANDINA VENEZUELA SA CARACAS, REPUBLICA
BOLIVARIANA DE VENEZUELA, RIF J-0056486-8, REGISTRO MP.P.S.PC-X-XX-IE,
PECCOCC000"
77913104,jabon de glicerina neutro farmacity,"Componentes INCI: alcohol, sucrose, tallow, aqua,
cocos nucifera, sorbitol, sodium hydroxide, oleoestea-
rine, glycerin, stearic acid, Cl 19140, CI 16035."
8432225114804,Curl activating gel,"DB0:&gt;B0 @C:01&gt;&lt;
 $!!, !,/.
"
7896018700307,Shampoo,"KE
K32068 FAB O7/20 00:50"
35000967237,Toms deo,"aluminum chlorohydrate (22%).......... uses reduces underarm wetness purpose antiperspirant 48 hour protection warnings for external use only do not use on broken skin ask doctor before use if you have kidney disease stop use if rash or irritation occurs keep out of reach of children. if swallowed, get medical help or contact a poison control center right away. (412-390-3381) directions apply to underarms only inactive ingredients elaeis guineensis (palm) kernel oil, stearyl alcohol, dicaprylyl ether, hydrogenated soybean oil, hydrogenated castor oil, natural fragrance, olea europaea (olive) leaf extract, maltodextrin o"
878639000230,Every man jack deo,"propanediol, water/eau, sodium stearate, polyglyceryl-10 caprylate/caprate, caprylyl glycol, fragrance/parfum, sodium chloride, cetyl alcohol, aloe barbadensis leaf extract*, hamamelis virginiana (witch hazel) leaf extract, gossypium herbaceum (cotton) seed extract, calendula officinalis flower extract, commiphora myrrha resin extract, usnea barbata (lichen) extract, citrus grandis (grapefruit) seed extract, chamomilla recutita (matricaria) flower extract*, fusanus spicatus (sandalwood) wood oil &quot;certified organic"
8480000467874,Desodorante gold,"BUTANE, ISOPROPYL MYRISTATE, COUMARIN, LIMONENE, BENDY SU
NOREDIENTS ALCOHOL DENAT, ISOBUTANE, PROPANE, PARFUM TRETHIL
Uicese preferentemente antes del final de (mes/ano): ver envase
CTRONELLOL LINALOOL, GERANIOL, EUGENOL, CITRAL
mens de 15 cm. Utilizar unicamente para o uso previsto.
HOs imediatamente com agua. Ndo
Autizar de nrof
ver
embalagem"
4005808837359,,"Aluminum
aqua
chlorohydrate, ppg-15
stearyl ether, steareth-2,
steareth-21,
hydrolyzed pearl, persea
gratissima oil, trisodium edta,
bht, geraniol, benzyl alcohol,
parfum"
8470006661079,Dalsy,"sacrosanto,sorbito (E-420),parahidroxibenzoato de propilo (E-216),parahidroxibenzoato de metilo (E-218),amarillo anaranjado (E-110),sodio y otros excipientes ."
3253581286791,loccitane sheah butter lip,"Approved FAIR TRADE BY ECOCERT Ingredients Butrospermum, Parki (Shea) Butter* - Tocopherol* Beurre de karité du / Shea butter from Burkina Faso 3 253581 286791 0IBKO1OK14 12M L'OCCITANE - 04100 Manosque"
8717163561096,Lip Therapy,"petrolatum, aloe barbadensis leaf extract, isopropyl myristate, aroma, citronellol, eugenol, limonene, linalool, 163 3jw uk"
8717163525555,Timotei Maxi Gel Cheveux Fixation Extra Forte à L'Extrait de Bambou 300ml,"Aqua, Alcohol Denat., VP/Methacrylamide/Vinyl Imidazole Copolymer, Triethanolamine, Phenoxyethanol, Acrylates/C10-30 Alkyl Acrylate Crosspolymer, Hydroxypropyltrimonium Hydrolyzed Corn Starch, Caprylyl Glycol, PEG-40 Hydrogenated Castor Oil, Trideceth-9, Parfum, Disodium EDTA, Propylene Glycol, Helianthus Annuus Seed Oil, Maltodextrin, Bambusa Vulgaris Leaf/Stem Extract, Commiphora Abyssinica Resin Extract, Citral, Geraniol, Hexyl Cinnamal, Limonene, Linalool."
7730905791927,,"3 337875 597197
hyl
r,
ate,
l,
gum,"
8712561479806,Intensive Care Essential Healing 200ml,"Vaseline Essential Healing Niisutav kreem

Maht: 200 ml

Ingredients: Aqua, Glycerin, Stearic Acid, Palmitic Acid, Isopropyl Myristate. Paraffinum Liquidum, Petrolatum, Avena Sativa Straw Extract,

Dimethicone, Dihydroxypropyltri-nonium Chloride. Hydroxyethyl Urea, Propylene Glycol. Lactic Acid Glyceryl Stearate. Glycol Stearate, PEG-100 Stearate, Cetyl Alcohol. Stearamide AMP, Sodium Hydroxide. Tapioca Starch, Magnesium Aluminum Silicate, Acrylates/C10-30 Alkyl Acrylate Crosspolymer, Xanthan Gum, Disodium EDTA Parfum, Methylparaben, Phenoxyethanol. Propylparaben, Alpha-Isomethyl Ionone. Amyl Cinnamal, Butylphenyl Methylpropional, Citronellol Coumarin, Hexyl Cinnamal, Geraniol, Benzyl Alcohol, Limonene, Linalool."
7610108047536,Zahnpaste Sensitive Professional,einigung** ang bis in die zahrzwischenräume elmex sofortige* & anhaltende linderung sensitive professional medizinische zahnpasta für sofortige schm wwofortige sohneeng indlichen zahnen klinisch bestätigt mit pro-argin formel
8710447169285,,100 recyceltes Plastik Dove Seidig - Zart 0S Suifat SLES seidig weiche Haut & onhaitende Pflege hauteigene Pflegestoffe PFLEGEDUSCHE
4005808378760,atrix,"Aqua, Cetyl Alcohol, Glycerin, Myristyl Alcohol, Sorbitan Stearate, Isopropyl Palmitate, Trilaureth-4 Phosphate, Cera Microcristallina, Octyldodecanol, Dimethicone, Cha - momilla Recutita Flower Extract, Paraffinum Liquidum, Caprylic/Capric Triglyceride, Sodium Citrate, Citric Acid, Phenoxyethanol, Methylparaben, Linalool, Citronellol, Limonene, Alpha - Isomethyl lonone, Eugenol, Parfum. BDF O00 Art.-Nr. 82004 150 ml e Beiersdorf Hamburg 12 M 4 &quot;005808&quot;378760 Made in Germany ® =reg. tm. of Beiersdorf AG 82004.9.5903.02"
8719238019303,Gommage a la pastèque,BEAUTY ENERGISING FACE SCRUB WATERMELON with natural baboo scrub trui extract VALUEE 96% wa refreshect 75n
856017000126,Cantu Shea Butter Leave-In Conditioning Repair Cream,nuts
50096190,Dove Original Roll-On Deoderant,"Aqua, Aluminum Chlorohydrate, Helianthus Annuus Seed Oil, Glycerin, Steareth-2, Parfum, Steareth-20, Disodium EDTA, Pentaerythrityl Alpha-Isomethyl Ionone, Benzyl Alcohol, Tetra-di-t-butyl Hydroxyhydrocinnamate, Benzyl Benzoate, Benzyl Salicylate, Citronellol, Eugenol, Geraniol, Hexyl Cinnamal, Hydroxycitronellal, Limonene, Linalool. Nicht auf verletzter Haut anwenden. Bei Auftreten von Hautirritationen nicht weiter verwenden."
7940149,suave,"ngredients: water (aqua), sodium c12-13 pareth sulfate, cocamidopropyl betaine, sodum chorice fragrance (parfum, glycerin, glycol stearate, sodium benzoate, citric aco quaternium-10, tetrasodium edta, tocopheryl acetate, stearamide amp butyrospermum parkii (shea) butter, theobroma cacao (cocoa) seed better, hydrolyzed protein, ppg-9, citrus aurantium dulcis (orange) peel oil, citrus limon lemon peel ol honey extract, hexyl cinnamal, linalool, blue 1 (ci 42090), red 33 (ci 17200), yellow 5 (ci 19140) empty &"
3577056022180,,WATER (AQUA). CAPRYLIC/CAPRIC TRIGLYCERIDE. GLYCERIN MINERAL OIL (PARAFFINUM LIQUIDUM). CETEARYL ALCOHOL. BEESWAX (CERA ALBA). ETHYLHEXYL PALMITATE. TRIOLEIN. CETEARYL GLUCOSIDE. CAPRYLYL GLYCOL ETHYLHEXYLGLYCERIN. GLYCYRRHETINIC ACID. HYDROXYETHYL ACRYLATE/SODIUM ACRYLOYLDIMETHYL TAURATE COPOLYMER. POLYSORBATE 60 SODIUM HYDROXIDE. SORBITAN ISOSTEARATE. SQUALANE. TOCOPHEROL
8712561484398,Vaseline Essential Healing Body Lotion,"aqua, glycerin, stearic acid, palmitic acid, isopropyl myristate, paraffinum liquidum, acrylates/c10-30 alkyl acrylate crosspolymer, averna sativa straw extract, cetyl alcohol, dimethicone, disodium edta, glyceryl stearate, glycol stearate, lactic acid, magnesium aluminum silicate, methylparaben, parfum, peg-100 stearate, petrolatum, phenoxyethanol, propylene glycol, propylparaben, sodium hydroxide, stearamide amp, tapioca starch, xanthan gum, alpha-isomethyl lonone, amyl cinnamal, benzyl alcohol, butylphenyl methylpropional, citronellol, coumarin, geraniol, hexyl cinnamal, limonene, linalool,"
8850006304839,Colgate plax fresh mint,mint
8480000440389,Hidro crema alisadora,"AQUA CYCLOPENTASILOXANE DIMETHICONE, POLYACRYLAMIDE, BAMBUSA
VULGARIS LEAF EXTRACT, HYDROLYZED PEARL C13-14 ISOPARAFFIN,
GLYCERIN, GUARHYDROXYPROPYLTRIMONIUM CHLORIDE, POLYSORBATE
20, PROPYLENE GLYCOL, PARFUM, LAURETH-7, PEG-33, DIAZOLIDINYL
UREA, PEG-8 DIMETHICONE, PEG-14, BHT, CITRIC ACID, TETRASODIUM
EDTA, LINALOOL ALPHA-ISOMETHYL IONONE, CITRONELLOL, SODIUM
HYDROXIDE, BUTYLPHENYL METHYLPROPIONAL, IODOPROPYNYL
BUTYLCARBAMATE, XANTHAN GUM, SODIUM BENZOATE, LACTIC
ACID, POTASSIUM SORBATE
Dermatologicamente testado. No utilizar para ninos
menores de 3 anos. Utilicese preferentemente antes
del final de: (mes/ano)."
8003520028815,Palmolive naturals,olive oil
8906015580235,die,"Lawsonia Inermis (Henna) Leaf Powder, Barium Peroxide, p-Phenylenediamine, OL-Tartaric Acid, Cellulose, Sodium Lauryl Sulphate, Sodium Sulfite Acacia Concirna (Shikakai) Fruit Powoer, Emblica Cflicinalis (Amla) Fruit Powder, Hit cus Sabdariffa (Jaswand) Flower Powder, Ne Barbadensis (Aloe Vera) Leaf Powder Sodium Carboxymethyl"
8901030683794,,complete active care
8906012520111,Aloevera,"ghrutkumari swaras
manjistha extract
rose petal extract
gel base"
8906013960442,Bioline,petroleum Jelly
8901277014481,Park avenue,"Ethyl, alcohol, propellant, perfume, aqua, isoproplyMyristate, cyclopentasiloxane, diethy phthalate, triclosan"
8901314077059,Mouthwash,"Aqua, Glycerin, Propylene Glycol, Sorbitol, Poloxamer 407, Aroma, Sodium Saccharin, Cetylpyridinium Chloride, Potassium Sorbate, Sodium Fluoride, Menthol, CI 19140, CI 42051. Contains Sodium Fluoride."
8809479166499,Snail essence mask,"ne face to let tne remaining essence absorb, [ngredents] water, glycerin, methylpropanediol, betaine, alcohol, 1,2hexanediol, peg-40 hydrogenated castor oil, xanthan gum, butylene glycol, sodium citrate, snail secretion filtrate(750ppm), ethylhexylgłycerin, citric acid, propanediol, disodium edta, allantoin, hydrolyzed collagen, fructooligosaccharides, saccharide h ydrolysate, centella asiatica extract, houttuynia cordata extract, salvia hispanica seed extract, pullulan, sodiu m hyaluronate, phenoxyethanol, fragrance"
8025272646741,Green me volume mascara,"ZH-��0�H�kۏ 	:s(���w���i
'D(-1J).
INGREDIENTS: AQUA (WATER/EAU), CERA AL BA (BEESWAX/CIRE D'ABEILLE), BUTYROSPERMUM PARKII BUTTER (BUTYROSPERMUM PARKII (SHEA) BUTTER), POLYGLYCERYL-6 DISTEARATE, DIMER DILINOLEYL
DIMER DILINOLEATE, COPERNICIA CERIFERA CERA (COPERNICIA CERIFERA (CARNAUBA) WAX/CIRE DE CARNAUBA), GLYCERIN, POLYGLYCERYL-10 MYRISTATE, CETYL ALCOHOL, GLYCERYL CAPRYLATE,
LEUCONOSTOC/RADISH ROOT FERMENT FILTRATE, ZEA MAYS STARCH (ZEA MAYS (CORN) STARCH), XANTHAN GUM, ARGININE, PHENETHYL ALCOHOL
HYDROLYZED RHODOPHYCEAE EXTRACT, PHENOXYETHANOL, CI 77499 (IRON OXIDES).
ITHORGANIG CITRUS FRUIT RESIDUE, 30% POST-CONSUMER RECYCLED, 100% GREEN ENERGY.- PAPIER ECOLOGIQUE
ENEDCIE VERTE"
7501026007101,Jabón neutro,"Hecho en Mexico por: Fabrica de Jal
Carlos B. Zetina No. 80, Parque Indu
de Mexico, C.P. 55348. Tels.:  52(55
www.lacorona.com.mx
(R)
Visitanos en: www.tersso.com.mx
Importado y distribuido en: Honduras por Modelica, S.A.
Tel.: 2540 2319. Nicaragua por Distribuidora Cesar Guerrero L.,
S.A. Tel.: 2265 1109. Registro Sanitario 02-19630708. Centro
de Toxicologia, Tels.: 2289 7150 y 2289 4200. Panama por
Distribuidora Centroamericana, S.A. Tel.: 399 5702.
Registro Sanitario 69692.
Ingredientes: Jabon, Cocoil isetionato de Sodio,
Glicerina y Perfume hipoalergenico."
4743318100319,Exfoliante corporal cacao organico y azucar,"ES EXFOLIANTE CORPORAL.
CHOCOLATE
BELGA. Este lujoso
exfoliante corporal hecho con manteca de cacao
organico y azucar natural restaura al instante la
elasticidad de su piel, dandole una flexibilidad increible y el
seductor aroma del chocolate. Forma de uso: Aplique sobre la piel
humeda con movimientos circulares, luego enjuague bien. Utilice de 2
a 3 veces a la semana para obtener unos resultados optimos.
IT SCRUB CORPO. CIOCCOLATO BELGA. Questo lussuoso scrub corpo e fatto con
burro biologico di cacao e zucchero naturale, per ridare immediatamente
elasticita alla vostra pelle assieme a una straordinaria fermezza e a un seduttivo sentore
di cioccolata. Indicazioni: Massaggiare la pelle bagnata con movimenti circolari quindi
risciacquare con cura. Usare 2-3 volte a settimana per ottenere i migliori risultati.
Ingredients: Sucrose, Glycerin, Cetearyl Alcohol, Butyrospermum Parkii Butter, Cocamidopropyl Betaine,
Theobroma Cacao Seed Butter*, Aqua, Parfum, Cl 77491, CI 77492, CI 77499. (*) - issued from organic agriculture
Made in Europe. Made under the license of LLC &quot;Organic Shop&quot;. Produced in compliance
with ISO 9001 and ISO 22716 (GMP) standards. Welcome to www.organic-shop.de
Responsible person: Eurobio Lab OU, Leiva str. 3, 12618 Tallinn, Estonia. 
250ml
/8,5 fl. oz
4o
12M
PP"
24006026,Acondicionador reparador y brillo 3 en 1,"Dermatologicamente testado.
Ingredients: Aqua, Aloe Barbadensis Leaf Juice*
Glycerin, Cetearyl Alcohol, Glycine Soja Oil,
Cocos Nucifera �il*, Glyceryl Stearate Citrate,
Malus Domestica Fruit Water*, Betaine, Buty-
rospermum Parkii Butter, PCA Glyceryl Oleate,
Persea Gratissima Fruit Extract*, Hydrolyzed
Wheat Protein, Sodium Hyaluronate, Citric Acid,
Xanthan Gum, Parfum**, Sodium Benzoate,
Benzyl Salicylate**, Limonene** Linalool*.
* Ingredientes procedentes de la agricultura
ecologica.
*Procedente de aceites escenciales."
190679000095,Golden moringa oil acondicionador,"0: 0800 100184, CL: 800 222 972, AR: 0800 999 7625, UY: 000-4054-027, PY: 009800-2038
MANUFACTURADO BAJO LA LICENCIA DE RBG KEW ENTERPRISES LTD. TODAS LAS UTILIDADETER
ENJUAGAR/APLIQUE UMA QUANTIDADE GENEROSA DE CONDICIONADOR NO CABELO NTO DAS
NOS./ADVERTENCIAS: EVITE O CONTATO COM OS OLHOS: SUSPENDA O USO SE 0OSERDAR
GENEROSA DE ACONDICIONADOR SOBRE EL PELO MOJADO DESDE LA RAIZ HASTA LAS PONTAS Y
LICENCA DA RBG KEW ENTERPRISES LTD. TODO O LUCRO PROVENIENTE DO RBG KEW ENTERON SES COO
SERA DESTINADO AO KEW PARA APOIAR SEU TRABALHO VITAL. WWW.KEW.ORG APLICAR UWA CANTIOND
LA EXOTICA PLANTA DE MORINGA SE CONSIDERA UNA DE LAS MAS RICAS EN NUT
DEJAR TU PELO SUAVE Y RENOVADO./A MORINGA E UMA PLANTA EXOTICA CONSICEA
90 NUTRIENTES Y 46 ANTIOXIDANTES. HERBAL ESSENCES BIO:RENEVW ACETE M
MUNDO. EL PRECIOSO ACEITE EXTRAIDO DE LAS SEMILLAS DE ESTE ARBOL CONTEN
DESTA ARVORE CONTEM MAIS DE 90 NUTRIENTES E 46 ANTIOXIDANTES HERGAL ESSOACE
DAS MAIS RICAS EM NUTRIENTES DO MUNDO. O PRECIOSO OLEO EXTRAID0 DAS SEVNITS
BIO:RENEW OLEO DE MORINGA DEIXAR SEU CABELO MACIO E RENOVADU
MORINGA OLEIFERA SEED OIL, ALOE BARBADENSIS LEAF JUICE, METHYLCHLOROSOTHIAOUNONE
IMONENE, LINALOOL, BENZYL SALICYLATE, HISTIDINE, CITRIC ACID, HYDROKYCHTONELL
Suaviza. Aceite de moringa dorado/Suaviza. Oleo de m
FEITO EM UMA FBRICA COM 0% DE RESIDUOS DESTINADOS AO ATERRO SANITAND
pH BALANCEADO Y SEGURO PARA EL PELO TENIDO/pH BALANCEADO E SEGURO PARA CASELOSTC
ACONDICIONADOR HECHO EN UNA FBRICA CON 0% RESIDUOS AL RELLENO SANITARIOICONDICIONADO
GUMA REAC�O DESFAVORAVEL. MANTENHA FORA DO ALCANCE DAS CRIANCAS
PREGUNTAS? MX: 01-800-123-7023, GT: 1800 300 0145, CR: 800-542-5321, SV: 800-6426, HN: 600-35
ENTERPRISES LTD. VAN A KEW PARA SOPORTAR SU TRABAJO VITAL wwW.KEW.ORG.FABRCAO SOBA
15-AMINOPROPYL DIMETHICONE, PARFUM, BENZYL ALCOHOL, DISODIUM EDTA HEXYL CNWMA
: 1800 226 0474, PA: 00800 054 0525, EC: 1800 102 058, CO: 01-800-917-0035, PE. 08
NGREDIENTES: AQUA, STEARYL ALCOHOL, BEHENTRIMONIUM CHLORIDE, CETYL ALCOHOL
RAIZES AS PONTAS E ENXAGUE. ADVERTENCIAS: EVITESE EL CONTACTO CON LOS OJOS SUSPENDA S
5O SI OBSERVA ALGUNA REACCION DESFAVORABLE. MANTENGASE FUERA DEL ALCANCE DE LOS
Herbal Essences
STARIE
BOTANIC
KEW
ERGUNTAS? LIGAC�O GRATUITA: BRASIL: 0800 7015515.
METHYLISOTHIAZOLINONE, ECKLONIA RADIATA EXTRACT. HECHO EN/ FABRICADONO N
ROCTER"
7506306215764,Crema facial,"AQUA, ETHYLHEXYL SALICYLATE, CYCLOPENTASILO
EGUCERIN BUTYL METHOXYDIBENZOYLMETHANE, OCTOCRYLENE, PHENYLBENZIMIDAZOLE SULFONC I
NE STEARIC ACID, PEG-10 STEARATE, TITANIUM DIOXIDE, CARBOMER, POTASSIUM HYDROXIDE, ACRU
NER DIMETHICONE, GLYCERYL STEARATE, PHENOXYETHANOL, CETYL ALCOHOL, PARFUM, SODIUMHIORD
PROPYLPARABEN, DISODIUM EDTA, BHT, PYRIDOXINE HCL, ALUMINUM HYDROXIDE, STEARAMDA
CACD, SODIUM ASCORBYL PHOSPHATE, TOCOPHERYL ACETATE, ALPHA-ISOMETHYL IONONE, B
RHENLMETHYLPROPIONAL, CITRAL, CITRONELLOL, GERANIOL, HEXYL CINNAMAI"
8480000468338,Crema hidratante para pies,"RNB La Pobla de Vallbona
CREMA DE PIES HIDRATANTE
CREME DE PES HIDRATANTE
eHidrata y suaviza la piel de los pies, especialmente indicada
para el tratamiento de pies secos, zonas asperas y callosas.
eHidrata e suaviza a pele dos pes, sendo especialmente
indicado para o tratamento dos pes secos e das zonas asperas
e calejadas.
MODO DE EMPLEO /MODO DE UTILIZAC�O
eAplicar 1-2 veces al dia y masajear, especialmente en los
talones y la planta, insistiendo en las zonas mas rugosas.
PAplique 1-2 vezes por dia e realize uma massagem,
especialmente nos calcanhares e na planta, insistindo nas
zonas mais rugosas.
INGREDIENTS
AQUA, GLYCERIN, ETHYLHEXYL PALMITATE, GLYCERYL STEARATE,
BUTYROSPERMUM PARKII BUTTER, CETYL ALCOHOL, DIMETHICONE,
PARAFFINUM LIQUIDUM, CETEARETH-20, PEG-8 BEESWAX, PRUNUS
AMYGDALUS DULCIS OIL, ALLANTOIN, TOCOPHERYL ACETATE,
TOCOPHEROL, ASCORBYL PALMITATE, CERA MICROCRISTALLINA,
PARAFFIN, CETEARETH-12, CETEARYL ALCOHOL, CETYL PALMITATE,
PARFUM, ACRYLATES/C10-30 ALKYL ACRYLATE CROSSPOLYMER,
BHT, PEG-8, ASCORBIC ACID, PHENOXYETHANOL, TETRASODIUM
GLUTAMATE DIACETATE, PIROCTONE OLAMINE, SODIUM HYDROXIDE,
CITRONELLOL, CITRIC ACID. [PI00762|
Utilicese preferentemente antes del final de /Lote: ver sellado.
Utilizar de prefer�ncia antes do fim de/Lote: ver vedante.
www.mercadona.com
900 500 103
0800 500 100
AMARILLO
AMARELO
DERMATOLOGICAMENTE
TESTADO
125ml
12 M
C/ Ausias March, 14
46185 Valencia Spain
2021.6.18 16"
